"image","caption","scheduled_at","status","buffer_post_id","posted_at"
"1 - Dressed to impress, not to explain 🤍.png","Dressed to impress, not to explain 🤍","2026-04-12 20:10","posted","69dbd77e2096be6bcd94c834","2026-04-12 20:34"
"27 - Too hot to handle, too cold to hold 🔥.png"," Too hot to handle, too cold to hold  🔥","2026-04-13 08:50","posted","69dc8941ccb433aff1a1dc81","2026-04-13 09:12"
"Blue velvet and white stockings. My kind of Monday 💙.png","Blue velvet and white stockings. My kind of Monday 💙","2026-04-14 08:50","posted","69ddd5ba89593640cceaf1f2","2026-04-14 08:51"
"My little black dress does most of the work tbh 😏.png","My little black dress does most of the work tbh 😏","2026-04-15 08:55","posted","69df297f425194020bf880d0","2026-04-15 09:00"
"Said I was sitting down for just a minute... somehow ended up looking like this 😅 Does this count as getting dressed.png","Said I was sitting down for just a minute... somehow ended up looking like this 😅 Does this count as getting dressed","2026-04-15 16:55","posted","69df9a037bbad562ea018d62","2026-04-15 17:00"
"Paris called. Obviously I answered 🗼.png","Paris called. Obviously I answered 🗼","2026-04-16 08:56","posted","69e07affedd42cea55bfc74b","2026-04-16 09:00"
"Paris called. Obviously I answered 🗼.png","Paris called. Obviously I answered 🗼","2026-04-16 10:40","posted","69e09392edd42cea55c0815f","2026-04-16 10:45"
"Good morning from my side of the bed ☀️.png","Good morning from my side of the bed ☀️","2026-04-17 07:55","posted","69e1be73a6f1f9c797eefda2","2026-04-17 08:00"
"Told myself I'd be productive this evening… the couch had other plans 😏 Would you come rescue me or just enjoy the view.png","Told myself I'd be productive this evening… the couch had other plans 😏 Would you come rescue me or just enjoy the view","2026-04-17 16:55","posted","69e23d05e74d9e4989283d7c","2026-04-17 17:00"
"Green was the vibe and I ran with it 🌿.png","Green was the vibe and I ran with it 🌿","2026-04-18 07:55","posted","69e30ff3d68594fa387ed98d","2026-04-18 08:00"
"I belong wherever the sea meets the sunset 🌊.png","I belong wherever the sea meets the sunset 🌊","2026-04-19 07:55","posted","69e461763a4ea0d014402480","2026-04-19 08:00"
"I don't need much to make a statement 🤍.png","I don't need much to make a statement 🤍","2026-04-20 07:55","posted","69e5b2f5bf5bb1a8240c6880","2026-04-20 08:00"
"I don't need much to make a statement 🤍.png","I don't need much to make a statement 🤍","2026-04-20 10:00","posted","69e5dd281cf22b0749945c6b","2026-04-20 11:01"
"Late nights and desk lamp energy 🌃.png","Late nights and desk lamp energy 🌃","2026-04-21 07:55","posted","69e70476c14076a2b3ce63e1","2026-04-21 08:01"
"Low to the ground, high on life 🖤.jpg","Low to the ground, high on life 🖤","2026-04-22 07:55","posted","69e855f4464b94cbacf09ea3","2026-04-22 08:01"
"Some mornings I just stay here a little longer 🌅.jpg","Some mornings I just stay here a little longer 🌅","2026-04-23 07:55","posted","69e9a77aa0e245be80fe1e82","2026-04-23 08:01"
"Champagne with a view. I've had worse evenings 🥂.png","Champagne with a view. I've had worse evenings 🥂","2026-04-24 08:55","posted","69eb070c8c7878fc1dcbda94","2026-04-24 09:01"
"First coffee, then everything else ☕.png","First coffee, then everything else ☕","2026-04-25 08:55","posted","69ec581de56655619b8a8594","2026-04-25 09:00"
"Golden hour found me exactly like this ☀️.png","Golden hour found me exactly like this ☀️","2026-04-26 08:55","posted","69edf757e56655619b95c297","2026-04-26 14:31"
"Told myself I was just sitting down for a second… the lace had other plans 🖤 Stay or go — what would you do.png","Told myself I was just sitting down for a second… the lace had other plans 🖤 Stay or go — what would you do","2026-04-27 07:55","posted","69eeed78e56655619b9cc4f0","2026-04-27 08:01"
"Sat on the bed to plan my evening… the boots decided for me 🖤 Would you take me out or keep me in.png","Sat on the bed to plan my evening… the boots decided for me 🖤 Would you take me out or keep me in","2026-04-28 07:55","posted","69f03ef2b85bfdc31a517595","2026-04-28 08:01"
"Meant to say goodnight… then the light came through the doorway and I lost track of time ✨ Stay or go — you decide.png","Meant to say goodnight… then the light came through the doorway and I lost track of time ✨ Stay or go — you decide","2026-04-29 07:55","posted","69f19071b85bfdc31a5b53e2","2026-04-29 08:01"
"Told myself it was just a quiet evening in… somehow ended up like this 🕯️ Is this what staying in looks like to you.png","Told myself it was just a quiet evening in… somehow ended up like this 🕯️ Is this what staying in looks like to you","2026-04-30 07:55","posted","69f2e1f564f99768ec92821a","2026-04-30 08:01"
"Sat down to take one quick photo… forty minutes later, still going 💙 Tell me I'm not the only one who does this.png","Sat down to take one quick photo… forty minutes later, still going 💙 Tell me I'm not the only one who does this","2026-05-01 07:55","posted","69f4337464f99768ec9d309e","2026-05-01 08:01"
"Started the evening with just watching the sunset… ended up in red silk with zero regrets 🔴 Who's joining me.png","Started the evening with just watching the sunset… ended up in red silk with zero regrets 🔴 Who's joining me","2026-05-02 07:55","posted","69f584efb2bf116e3e412d07","2026-05-02 08:01"
"Leaned here for just a second… stayed for the whole mood 🔴 Do I look like I have somewhere to be.png","Leaned here for just a second… stayed for the whole mood 🔴 Do I look like I have somewhere to be","2026-05-03 07:55","posted","69f6d59eebb6d538a0e03eb8","2026-05-03 07:58"
"Told myself I'd get dressed an hour ago… the lamplight and the silk had other plans ✨ Anyone else.png","Told myself I'd get dressed an hour ago… the lamplight and the silk had other plans ✨ Anyone else","2026-05-04 07:55","posted","69f82744766f329adc2b2164","2026-05-04 07:58"
"Told myself I'd stay in tonight… then the rain made everything look like a movie 🌧️ Some evenings just pull you outside.png","Told myself I'd stay in tonight… then the rain made everything look like a movie 🌧️ Some evenings just pull you outside","2026-05-05 07:55","posted","69f97974042507da7a02f443","2026-05-05 08:01"
"Sat down to do absolutely nothing… and the evening light turned it into a whole moment 🔴 Is it the red or the light.png","Sat down to do absolutely nothing… and the evening light turned it into a whole moment 🔴 Is it the red or the light","2026-05-06 07:55","posted","69facaf4508055e614681468","2026-05-06 08:01"
"Told myself this was just a quick mirror check… then I sat down and the roses took over 🌹 Guilty as charged.png","Told myself this was just a quick mirror check… then I sat down and the roses took over 🌹 Guilty as charged","2026-05-07 07:55","posted","69fc1c78193634c274652698","2026-05-07 08:01"
"Walked into this room and immediately forgot whatever I was stressed about 🌸 Sometimes pink fixes everything — agree.png","Walked into this room and immediately forgot whatever I was stressed about 🌸 Sometimes pink fixes everything — agree","2026-05-08 07:55","posted","69fd6df594c445cd61d05f6b","2026-05-08 08:01"
"Sat here to think… spent the whole time practicing this instead 🖤 Overthinking never looked this good — or did it.png","Sat here to think… spent the whole time practicing this instead 🖤 Overthinking never looked this good — or did it","2026-05-09 07:55","posted","69febf7180da435d7b52cbf9","2026-05-09 08:01"
"Sat down for five minutes to take a break… ended up reconsidering every outfit decision I've ever made 💚 Soft or strong — pick one.png","Sat down for five minutes to take a break… ended up reconsidering every outfit decision I've ever made 💚 Soft or strong — pick one","2026-05-10 07:55","posted","6a0010f38c697e6b3c2212d6","2026-05-10 08:01"
