"image","caption","scheduled_at","status","buffer_post_id","posted_at"
"1 - Dressed to impress, not to explain 🤍.png","Dressed to impress, not to explain 🤍","2026-04-12 20:10","posted","69dbd77e2096be6bcd94c834","2026-04-12 20:34"
"27 - Too hot to handle, too cold to hold 🔥.png"," Too hot to handle, too cold to hold  🔥","2026-04-13 08:50","posted","69dc8941ccb433aff1a1dc81","2026-04-13 09:12"
"Blue velvet and white stockings. My kind of Monday 💙.png","Blue velvet and white stockings. My kind of Monday 💙","2026-04-14 08:50","posted","69ddd5ba89593640cceaf1f2","2026-04-14 08:51"
"My little black dress does most of the work tbh 😏.png","My little black dress does most of the work tbh 😏","2026-04-15 08:55","posted","69df297f425194020bf880d0","2026-04-15 09:00"
"Said I was sitting down for just a minute... somehow ended up looking like this 😅 Does this count as getting dressed.png","Said I was sitting down for just a minute... somehow ended up looking like this 😅 Does this count as getting dressed","2026-04-15 16:55","posted","69df9a037bbad562ea018d62","2026-04-15 17:00"
"Paris called. Obviously I answered 🗼.png","Paris called. Obviously I answered 🗼","2026-04-16 08:56","posted","69e07affedd42cea55bfc74b","2026-04-16 09:00"
"Paris called. Obviously I answered 🗼.png","Paris called. Obviously I answered 🗼","2026-04-16 10:40","posted","69e09392edd42cea55c0815f","2026-04-16 10:45"
"Good morning from my side of the bed ☀️.png","Good morning from my side of the bed ☀️","2026-04-17 07:55","posted","69e1be73a6f1f9c797eefda2","2026-04-17 08:00"
"Told myself I'd be productive this evening… the couch had other plans 😏 Would you come rescue me or just enjoy the view.png","Told myself I'd be productive this evening… the couch had other plans 😏 Would you come rescue me or just enjoy the view","2026-04-17 16:55","posted","69e23d05e74d9e4989283d7c","2026-04-17 17:00"
"Green was the vibe and I ran with it 🌿.png","Green was the vibe and I ran with it 🌿","2026-04-18 07:55","posted","69e30ff3d68594fa387ed98d","2026-04-18 08:00"
"I belong wherever the sea meets the sunset 🌊.png","I belong wherever the sea meets the sunset 🌊","2026-04-19 07:55","posted","69e461763a4ea0d014402480","2026-04-19 08:00"
"I don't need much to make a statement 🤍.png","I don't need much to make a statement 🤍","2026-04-20 07:55","posted","69e5b2f5bf5bb1a8240c6880","2026-04-20 08:00"
"I don't need much to make a statement 🤍.png","I don't need much to make a statement 🤍","2026-04-20 10:00","posted","69e5dd281cf22b0749945c6b","2026-04-20 11:01"
"Late nights and desk lamp energy 🌃.png","Late nights and desk lamp energy 🌃","2026-04-21 07:55","posted","69e70476c14076a2b3ce63e1","2026-04-21 08:01"
"Low to the ground, high on life 🖤.jpg","Low to the ground, high on life 🖤","2026-04-22 07:55","posted","69e855f4464b94cbacf09ea3","2026-04-22 08:01"
