"image","caption","scheduled_at","status","tweet_id"
"2026-03-22_08h00 - City views are nice. But have you seen me.png","City views are nice. But have you seen me","2026-04-24 17:50","",""
"Red gloves. Black stockings. No explanation needed 🖤.png","Red gloves. Black stockings. No explanation needed 🖤","2026-04-25 08:50","",""
"Something blue. Something new. Something entirely mine 💙.png","Something blue. Something new. Something entirely mine 💙","2026-04-26 08:50","",""
"Black dress, white stairs, and absolutely zero intentions of moving 🖤 Should I behave... or.png","Black dress, white stairs, and absolutely zero intentions of moving 🖤 Should I behave... or","2026-04-27 07:50","",""
"Black lace on white stairs... the contrast is doing things 🖤 Should I come down... or are you coming up.png","Black lace on white stairs... the contrast is doing things 🖤 Should I come down... or are you coming up","2026-04-28 07:50","",""
"Black lace, dark room, and the kind of eye contact that gets people in trouble 🖤 Should I behave… or.png","Black lace, dark room, and the kind of eye contact that gets people in trouble 🖤 Should I behave… or","2026-04-29 07:50","",""
"Borrowed the shirt. Kept the coffee. Skipped the rest ☕ Morning light in this kitchen is doing things I didn't ask for… Should I button up or is this already your problem.png","Borrowed the shirt. Kept the coffee. Skipped the rest ☕ Morning light in this kitchen is doing things I didn't ask for… Should I button up or is this already your problem","2026-04-30 07:50","",""
"Candles lit, black lace on, and nobody asked me to do this 🕯️ I just felt like it… Should I blow them out or leave them burning for you.png","Candles lit, black lace on, and nobody asked me to do this 🕯️ I just felt like it… Should I blow them out or leave them burning for you","2026-05-01 07:50","",""
"Dressed for the occasion... that's all I'll say 🖤 Come find me before the coffee gets cold - if you can focus long enough.png","Dressed for the occasion... that's all I'll say 🖤 Come find me before the coffee gets cold - if you can focus long enough","2026-05-03 07:50","",""
"Dressed for trouble, sitting still for no one 😈 Kalimera, do I look like your reason to call in late.png","Dressed for trouble, sitting still for no one 😈 Kalimera, do I look like your reason to call in late","2026-05-04 07:50","",""
"Ended up against this wall and decided to stay... I'm nothing if not obedient 🔴 Should I turn around or keep looking at you like this.png","Ended up against this wall and decided to stay... I'm nothing if not obedient 🔴 Should I turn around or keep looking at you like this","2026-05-05 07:50","",""
"Ended up on the floor in silk and lace and I have absolutely no explanation 🤍 The light was perfect and I'm not sorry… Would you help me up or just stand there.jpg","Ended up on the floor in silk and lace and I have absolutely no explanation 🤍 The light was perfect and I'm not sorry… Would you help me up or just stand there","2026-05-06 07:50","",""
"Evening light hit the red and suddenly everything had a whole new meaning 🔴 Still want to ask how my day was.png","Evening light hit the red and suddenly everything had a whole new meaning 🔴 Still want to ask how my day was","2026-05-07 07:50","",""
"Evening unwind started with just five minutes on the sofa... white lace, soft lamp, completely lost track of time 🤍 Should I move... or would you rather I didn't.png","Evening unwind started with just five minutes on the sofa... white lace, soft lamp, completely lost track of time 🤍 Should I move... or would you rather I didn't","2026-05-08 07:50","",""
"Fresh out of the shower and already causing problems 😏 Would you knock or just stand there.png","Fresh out of the shower and already causing problems 😏 Would you knock or just stand there","2026-05-09 07:50","",""
"Golden hour hit the sofa and suddenly getting up felt illegal ☀️ Green, denim, and zero productivity… Should I stay exactly like this or give you something better.png","Golden hour hit the sofa and suddenly getting up felt illegal ☀️ Green, denim, and zero productivity… Should I stay exactly like this or give you something better","2026-05-10 07:50","",""
"Just a quick shower… said no one who looked like this 🤍 I'll be done when I'm done — or when you give me a reason to hurry.png","Just a quick shower… said no one who looked like this 🤍 I'll be done when I'm done — or when you give me a reason to hurry","2026-05-12 07:50","",""
"Kalimera from the kitchen counter… plaid, lace socks, and zero plans to get down anytime soon ☕ Should I make you breakfast or is this already enough distraction.png","Kalimera from the kitchen counter… plaid, lace socks, and zero plans to get down anytime soon ☕ Should I make you breakfast or is this already enough distraction","2026-05-13 07:50","",""
"Lit the candles, put on the red, and decided the evening was mine 🕯️ Still want to ask how my day was… or are you already distracted.png","Lit the candles, put on the red, and decided the evening was mine 🕯️ Still want to ask how my day was… or are you already distracted","2026-05-14 07:50","",""
"Morning check-in - navy lace, soft sheets, nowhere to be 💙 Do I look like someone who has her life together or someone way more fun.png","Morning check-in - navy lace, soft sheets, nowhere to be 💙 Do I look like someone who has her life together or someone way more fun","2026-05-15 07:50","",""
"Red lace, red gloves, and absolutely no apologies ❤️‍🔥 This is the version of me that shows up when the evening gets interesting… Are you ready for it.png","Red lace, red gloves, and absolutely no apologies ❤️‍🔥 This is the version of me that shows up when the evening gets interesting… Are you ready for it","2026-05-16 07:50","",""
"Silk robe, morning light, and the longest shower you can imagine ☀️ Taking my time today… Would you wait or come find me.png","Silk robe, morning light, and the longest shower you can imagine ☀️ Taking my time today… Would you wait or come find me","2026-05-19 07:50","",""
"Started the morning in the kitchen... said I'd make coffee but the counter got me first 🔴 Still hungry or distracted already.png","Started the morning in the kitchen... said I'd make coffee but the counter got me first 🔴 Still hungry or distracted already","2026-05-21 07:50","",""
"Still at the desk, city lights on, and completely done pretending to work 🌃 Someone give me a reason to close the laptop… Should I wait or send you an invite.png","Still at the desk, city lights on, and completely done pretending to work 🌃 Someone give me a reason to close the laptop… Should I wait or send you an invite","2026-05-22 07:50","",""
"Stood in this doorway for you... the least you can do is not keep me waiting 😌 Should I open it wider or is this enough.png","Stood in this doorway for you... the least you can do is not keep me waiting 😌 Should I open it wider or is this enough","2026-05-23 07:50","",""
"Summer nights, string lights, and exactly zero reasons to behave 🖤 Should I stay out here or give you something better to look at inside.png","Summer nights, string lights, and exactly zero reasons to behave 🖤 Should I stay out here or give you something better to look at inside","2026-05-24 07:50","",""
"Sunset in the sea and I'm not coming out 🌅 The water's warm and the view from here is exactly what you think it is… Should I wave or let you swim to me.png","Sunset in the sea and I'm not coming out 🌅 The water's warm and the view from here is exactly what you think it is… Should I wave or let you swim to me","2026-05-25 07:50","",""
"The car's fast. I'm faster 🖤 Neon lights, leather, and the kind of evening that doesn't need a plan… Should I drive or let you.png","The car's fast. I'm faster 🖤 Neon lights, leather, and the kind of evening that doesn't need a plan… Should I drive or let you","2026-05-26 07:50","",""
"The city never sleeps and apparently neither do I 🌃 Still in the office, still in the skirt, still open to suggestions… What would you do if you walked in right now.png","The city never sleeps and apparently neither do I 🌃 Still in the office, still in the skirt, still open to suggestions… What would you do if you walked in right now","2026-05-27 07:50","",""
"They asked me to be productive... I wrapped myself in silk and negotiated 🤍 Is this your kind of distraction.png","They asked me to be productive... I wrapped myself in silk and negotiated 🤍 Is this your kind of distraction","2026-05-28 07:50","",""
"Went deep into the woods in red and I'm not even a little sorry 🔴 Found a tree older than every excuse I've ever been given… Come find me if you dare.png","Went deep into the woods in red and I'm not even a little sorry 🔴 Found a tree older than every excuse I've ever been given… Come find me if you dare","2026-05-30 07:50","",""
"Candles, mirrors, and this… I just came in to wash my face 🕯️ Somehow ended up like this and I’m not even a little sorry… Should I turn the lights off or leave them on.png","Candles, mirrors, and this… I just came in to wash my face 🕯️ Somehow ended up like this and I’m not even a little sorry… Should I turn the lights off or leave them on","2026-05-02 07:50","",""
"Green was calling and I answered… now I’m standing here and I feel nothing but right 🌿 Behave or don’t — your call.png","Green was calling and I answered… now I’m standing here and I feel nothing but right 🌿 Behave or don’t — your call","2026-05-11 07:50","",""
"Someone sent flowers and balloons and I have absolutely no complaints 🌸 The real question is what you’re going to do to top this… I’m listening.png","Someone sent flowers and balloons and I have absolutely no complaints 🌸 The real question is what you’re going to do to top this… I’m listening","2026-05-20 07:50","",""
"Rooftop at golden hour and I caught you looking 🌅 I’m not mad about it… Should I turn around or let you enjoy the view.png","Rooftop at golden hour and I caught you looking 🌅 I’m not mad about it… Should I turn around or let you enjoy the view","2026-05-17 07:50","",""
"Rooftop, sunset, and the whole city below me 🌅 I don’t need a reason to be up here… but I wouldn’t say no to company. Are you coming up.png","Rooftop, sunset, and the whole city below me 🌅 I don’t need a reason to be up here… but I wouldn’t say no to company. Are you coming up","2026-05-18 07:50","",""
"Warm light, black lace, and the kind of evening that starts slow and goes wherever it wants 🖤 I’m not in a hurry… Are you.png","Warm light, black lace, and the kind of evening that starts slow and goes wherever it wants 🖤 I’m not in a hurry… Are you","2026-05-29 07:50","",""
"Morning light, arms up, zero thoughts 🖤 Who else stretches like they're posing for something - should I behave today... or.png","Morning light, arms up, zero thoughts 🖤 Who else stretches like they're posing for something - should I behave today... or","2026-05-31 07:50","",""
"The couch said stay horizontal... I took that personally 😌 Should I behave or just stay exactly like this.png","The couch said stay horizontal... I took that personally 😌 Should I behave or just stay exactly like this","2026-06-01 07:50","",""
"Arms up, candlelight, gold on everything… Cleopatra didn't ask for permission and neither do I 🕯️ Should I behave… or.png","Arms up, candlelight, gold on everything… Cleopatra didn't ask for permission and neither do I 🕯️ Should I behave… or","2026-04-24 21:00","",""
"Black leather, city lights behind me, and a mission I'll only share if you ask nicely 🖤 Do I look like trouble or your favourite kind of problem.png","Black leather, city lights behind me, and a mission I'll only share if you ask nicely 🖤 Do I look like trouble or your favourite kind of problem","2026-05-01 18:00","",""
"Black satin, bunny ears, crawling toward the camera like I'm not your problem yet… but I'm about to be 🐰 Should I behave… or keep coming closer.png","Black satin, bunny ears, crawling toward the camera like I'm not your problem yet… but I'm about to be 🐰 Should I behave… or keep coming closer","2026-05-08 18:00","",""
"Bronze armor, torchlight, flat on the floor like I own every inch of it 🔥 A warrior rests on her own terms. Care to join me down here.png","Bronze armor, torchlight, flat on the floor like I own every inch of it 🔥 A warrior rests on her own terms. Care to join me down here","2026-05-15 18:00","",""
"Corset laced, arms up, lamp burning low… some inventions are better left unexplained ⚙️ Should I behave… or show you what I've been working on.png","Corset laced, arms up, lamp burning low… some inventions are better left unexplained ⚙️ Should I behave… or show you what I've been working on","2026-05-22 18:00","",""
"Diamonds, stripes, sitting exactly how I want because chaos is kind of my thing 🃏 Should I behave… or is that already off the table.png","Diamonds, stripes, sitting exactly how I want because chaos is kind of my thing 🃏 Should I behave… or is that already off the table","2026-05-29 18:00","",""
"Glasses on, shirt open, sitting on the desk like the agenda changed the moment I walked in 💻 The work can wait. Should I stay late… or.png","Glasses on, shirt open, sitting on the desk like the agenda changed the moment I walked in 💻 The work can wait. Should I stay late… or","2026-06-05 18:00","",""
"Iridescent scales, arms stretched, lying in soft light like the sea washed me here just for you 🌊 Do I look like trouble or treasure.png","Iridescent scales, arms stretched, lying in soft light like the sea washed me here just for you 🌊 Do I look like trouble or treasure","2026-06-12 18:00","",""
"Pick a card. I always win… and the prize tonight is me leaning closer than you expected 🃏 Should I reveal the trick or keep you guessing.png","Pick a card. I always win… and the prize tonight is me leaning closer than you expected 🃏 Should I reveal the trick or keep you guessing","2026-06-19 18:00","",""
"Red everything, legs open, horns because I earned them 😈 Soft light, less soft intentions. Do I look like your reason to sin tonight.png","Red everything, legs open, horns because I earned them 😈 Soft light, less soft intentions. Do I look like your reason to sin tonight","2026-06-26 18:00","",""
"Red suit, warm light, coming in close because the distance between us is the only thing I plan to fix tonight 💥 Do I look like your reason to stay in bed.png","Red suit, warm light, coming in close because the distance between us is the only thing I plan to fix tonight 💥 Do I look like your reason to stay in bed","2026-07-03 18:00","",""
"Red up top, black underneath, and not slowing down for anyone 🏎️ Warm light, warm skin, and zero interest in finishing last. Ready to keep up.png","Red up top, black underneath, and not slowing down for anyone 🏎️ Warm light, warm skin, and zero interest in finishing last. Ready to keep up","2026-07-10 18:00","",""
"Red, white, and absolutely no intention of behaving tonight 📣 Soft light, bare legs, and a smile that knows exactly what it's doing… Should I cheer you on or let you figure it out yourself.png","Red, white, and absolutely no intention of behaving tonight 📣 Soft light, bare legs, and a smile that knows exactly what it's doing… Should I cheer you on or let you figure it out yourself","2026-07-17 18:00","",""
"Soft lamp, silk barely closed, red lips that aren't sorry about any of it 🪔 Tell me — would you knock or just walk straight in.png","Soft lamp, silk barely closed, red lips that aren't sorry about any of it 🪔 Tell me — would you knock or just walk straight in","2026-07-24 18:00","",""
"The uniform came with a short skirt and zero apologies. Soft light, white lace, and all the intention in the world 🖤 Do I look like your reason to stay home tonight.png","The uniform came with a short skirt and zero apologies. Soft light, white lace, and all the intention in the world 🖤 Do I look like your reason to stay home tonight","2026-07-31 18:00","",""
"The uniform says professional. The lace underneath says something completely different… 💙 Do I look like your reason to miss your flight.png","The uniform says professional. The lace underneath says something completely different… 💙 Do I look like your reason to miss your flight","2026-08-07 18:00","",""
"Tied top, navy skirt, arms up because I can… Don't let the badge fool you — I make my own rules tonight 😈 Should I behave… or.png","Tied top, navy skirt, arms up because I can… Don't let the badge fool you — I make my own rules tonight 😈 Should I behave… or","2026-08-14 18:00","",""
"White shirt, plaid skirt, legs crossed like I'm not causing problems on purpose… 😇 Do I look like your reason to stay after class.png","White shirt, plaid skirt, legs crossed like I'm not causing problems on purpose… 😇 Do I look like your reason to stay after class","2026-08-21 18:00","",""
"White uniform, white stockings, and the kind of bedside manner they don't teach in school 💉 Do I look like your reason to fake being sick.png","White uniform, white stockings, and the kind of bedside manner they don't teach in school 💉 Do I look like your reason to fake being sick","2026-08-28 18:00","",""
