"image","caption","scheduled_at","status","tweet_id"
"Outdoor seating was the right call.png","Outdoor seating was the right call","2026-04-17 08:50","",""
"My kitchen. My rules. My shade of blue 💙.png","My kitchen. My rules. My shade of blue 💙","2026-04-18 08:50","",""
"2026-03-09_17h00 - Midnight swim was not optional tonight 🌊.png","Midnight swim was not optional tonight 🌊","2026-04-19 08:50","",""
"2026-03-18_08h00 - Soft lighting, softer mood. Just me tonight 🕯️.png","Soft lighting, softer mood. Just me tonight 🕯️","2026-04-20 17:50","",""
"2026-03-19_08h00 - This is my version of getting dressed up 🖤.png","This is my version of getting dressed up 🖤","2026-04-21 17:50","",""
"2026-03-19_17h00 - Hotel rooms hit different when you're in silk 💙.png","Hotel rooms hit different when you're in silk 💙","2026-04-22 17:50","",""
"2026-03-21_08h00 - Yes I made pancakes in this. What about it.png","Yes I made pancakes in this. What about it","2026-04-23 17:50","",""
"2026-03-22_08h00 - City views are nice. But have you seen me.png","City views are nice. But have you seen me","2026-04-24 17:50","",""
"Some evenings I just wrap myself in red and forget the world exists 🍷.png","Some evenings I just wrap myself in red and forget the world exists 🍷","2026-04-22 07:50","",""
"Golden hour hits different when you're already on fire 🔴.png","Golden hour hits different when you're already on fire 🔴","2026-04-23 07:50","",""
"I don't need a throne — a velvet sofa and good lighting will do 👑.png","I don't need a throne — a velvet sofa and good lighting will do 👑","2026-04-24 07:50","",""
"Red gloves. Black stockings. No explanation needed 🖤.png","Red gloves. Black stockings. No explanation needed 🖤","2026-04-25 08:50","",""
"Something blue. Something new. Something entirely mine 💙.png","Something blue. Something new. Something entirely mine 💙","2026-04-26 08:50","",""
